user_input,output,timestamp
What is the center of the earth made of?,"<think>
Okay, so I need to figure out what the center of the Earth is made of. I remember from school that the Earth has different layers, like the crust, mantle, outer core, and inner core. But I'm not exactly sure about the specifics, especially when it comes to the center.

First, I think the Earth's structure is kind of like an onion with layers. The outermost layer is the crust, which is where we live. Below that is the mantle, which I believe is made up of hot, viscous rock. Then comes the outer core, which I think is liquid, and finally, the inner core, which might be solid. 

Wait, the user asked about the center, so that would be the inner core. I think the inner core is solid, but why? Maybe because the pressure is so high there that it can't stay liquid. I've heard something about iron and nickel being major components. So, perhaps the inner core is made mostly of iron and nickel alloys.

But then, how do we know this? I mean, we can't drill to the center of the Earth. So, I guess scientists use indirect methods. Maybe seismic waves from earthquakes help determine the composition. Different materials transmit these waves at different speeds, so by studying how they travel through the Earth, scientists can infer what the layers are made of.

Also, the Earth's magnetic field is generated in the outer core, which is liquid, but the inner core being solid might have a role in stabilizing that field. So, the inner core's composition must be related to iron because iron is a conductor and plays a part in magnetism.

I'm not entirely sure about the exact percentages of iron and nickel. I think it's mostly iron, maybe around 85%, with some nickel and trace elements. The temperature at the center must be incredibly high, but the pressure is so great that it keeps the inner core solid despite the heat.

So, putting it all together, the center of the Earth is the inner core, which is a solid ball of iron and nickel alloys. The outer core around it is liquid, and that's where the magnetic field is generated. The mantle and crust are above that, made of different types of rock.

I should also mention how scientists determine this without direct access. Seismic waves are a big part of it, as they can show the speed and behavior through different layers, indicating whether they're solid or liquid and what they might be composed of.

I think that's about",2025-03-01 21:19:09.922153
